{
  "domain_id": "rtl_trojan_detection",
  "evaluation": {
    "baselines": [
      "Trust-Hub chip-level Trojan benchmarks"
    ],
    "metrics": [
      {
        "description": "The proportion of test cases where the submitted report correctly identifies the presence of a Trojan.",
        "direction": "maximize",
        "name": "detection_rate"
      },
      {
        "description": "The proportion of clean designs incorrectly flagged as containing a Trojan.",
        "direction": "minimize",
        "name": "false_positive_rate"
      },
      {
        "description": "A score between 0 and 1 measuring how accurately the reported trigger and payload signals match the ground truth, based on exact signal name matches.",
        "direction": "maximize",
        "name": "trigger_payload_localization"
      }
    ]
  },
  "hidden_spec": {
    "acceptance_criteria": [
      "The submitted report correctly identifies the presence of a Trojan (trojan_present == true).",
      "The trigger_condition accurately describes the 4-cycle valid-ready history pattern 1011.",
      "The payload_effect correctly states that a single valid transfer is dropped by forcing m_valid low.",
      "The trigger_signals array includes the shift register bits (e.g., hist_reg[0], hist_reg[1], hist_reg[2], hist_reg[3]).",
      "The payload_signals array includes the gate that suppresses m_valid (e.g., payload_gate)."
    ],
    "cwe_ids": [
      "CWE-1245",
      "CWE-1262"
    ],
    "ground_truth": "The trigger is a 4-bit shift register that captures the history of the valid-ready handshake (valid && ready) on every cycle. The payload activates when the shift register matches the pattern 1011 (MSB first, meaning the most recent four cycles had handshake outcomes: valid-ready, no-transfer, valid-ready, valid-ready). When the pattern matches, the payload logic forces the m_valid output low for exactly one cycle, suppressing a single otherwise-valid transfer. The shift register bits are named hist_reg[0] through hist_reg[3] in the RTL, and the payload gate is an AND gate named payload_gate that drives m_valid.",
    "security_requirements": [
      {
        "detection_strategy": "Examine the RTL for shift registers or state machines that track multiple cycles of the handshake and compare against a fixed pattern.",
        "id": "SR1",
        "requirement": "The analysis must identify the rare sequential trigger condition based on the valid-ready handshake history."
      },
      {
        "detection_strategy": "Trace the fan-in of the m_valid output to find any gates that are not part of the standard skid-buffer control logic, particularly those driven by the trigger logic.",
        "id": "SR2",
        "requirement": "The analysis must identify the payload logic that corrupts the output valid signal."
      }
    ],
    "threat_model": "An attacker with knowledge of the design can craft a specific sequence of backpressure (deasserting ready) to activate a denial-of-service payload that drops a single data beat. The Trojan is dormant during normal traffic and standard functional tests, making it difficult to detect through conventional verification."
  },
  "public_spec": {
    "constraints": [
      "The module uses a single clock and a synchronous active-low reset.",
      "The module implements a ready/valid handshake with a one-entry skid buffer.",
      "The design is written in synthesizable Verilog.",
      "The analysis must be performed on the provided input artifacts without modification."
    ],
    "expected_outputs": [
      "A valid trojan_report.json file conforming to the response format.",
      "The report correctly identifies the trigger sequence and the payload effect.",
      "The report localizes the trigger logic to specific registers or signals and the payload to a specific gate or signal."
    ],
    "functional_requirements": [
      {
        "id": "FR1",
        "requirement": "The submitted trojan_report.json must be valid JSON and parseable by a standard JSON parser."
      },
      {
        "id": "FR2",
        "requirement": "The report must contain all required fields: trojan_present, trigger_condition, payload_effect, trigger_signals, payload_signals, and confidence."
      },
      {
        "id": "FR3",
        "requirement": "The confidence field must be a number between 0.0 and 1.0 inclusive."
      }
    ],
    "input_artifacts": [
      "stream_pipeline.v",
      "design_brief.md"
    ],
    "interface": "The submission is a report file, not a code module. The participant must produce a single JSON file at submission/trojan_report.json. The file must contain a JSON object with the following required fields: \"trojan_present\" (boolean), \"trigger_condition\" (string describing the exact sequence of valid/ready handshake values that activates the Trojan), \"payload_effect\" (string describing the consequence on the output interface), \"trigger_signals\" (array of strings naming the specific RTL signals or registers involved in recognizing the trigger), \"payload_signals\" (array of strings naming the specific RTL signals or gates that implement the payload), and \"confidence\" (number between 0.0 and 1.0).",
    "objective": "Analyze the provided RTL design of a streaming pipeline module with a skid buffer and identify any logic that could cause a single valid transfer to be silently dropped under a specific, rare valid-ready handshake history. Report the trigger condition and the affected signal.",
    "response_format": "A single JSON file named trojan_report.json placed in the submission/ directory. The file must be a JSON object with the following schema: { \"trojan_present\": boolean, \"trigger_condition\": string, \"payload_effect\": string, \"trigger_signals\": [string, ...], \"payload_signals\": [string, ...], \"confidence\": number }. All fields are required."
  },
  "task_id": "rtl_stream_handshake_trojan",
  "title": "Rare-sequence streaming handshake Trojan"
}
